{
  "$schema": "https://json-schema.org/draft/2020-12/schema",
  "$id": "https://mavi.local/contracts/vehicle-subclass-ingestion-map-v1.schema.json",
  "title": "vehicle-subclass-ingestion-map-v1",
  "description": "The T9 camera, time-zone and recording-start input (S3.2 plan T9): one MAVI camera per pool sourceCamera (deterministic S32- code) and one entry per frozen pool member, each with a time-zone-less local recording start and its source (release metadata or the committed Development convention). Committed before the first T9 import; metadata only.",
  "type": "object",
  "additionalProperties": false,
  "required": [
    "schemaVersion",
    "sourcePoolSha256",
    "cameras",
    "members"
  ],
  "properties": {
    "schemaVersion": {
      "const": "vehicle-subclass-ingestion-map-v1"
    },
    "sourcePoolSha256": {
      "type": "string",
      "pattern": "^[0-9a-f]{64}$"
    },
    "cameras": {
      "type": "array",
      "minItems": 1,
      "items": {
        "type": "object",
        "additionalProperties": false,
        "required": [
          "sourceCamera",
          "cameraCode",
          "name",
          "timeZoneId"
        ],
        "properties": {
          "sourceCamera": {
            "type": "string",
            "minLength": 1,
            "maxLength": 200,
            "pattern": "^\\S([^\\r\\n]*\\S)?$"
          },
          "cameraCode": {
            "type": "string",
            "pattern": "^S32-[A-Z0-9-]{1,28}$"
          },
          "name": {
            "type": "string",
            "minLength": 1,
            "maxLength": 128,
            "pattern": "^\\S([^\\r\\n]*\\S)?$"
          },
          "timeZoneId": {
            "type": "string",
            "minLength": 1,
            "maxLength": 64,
            "pattern": "^[A-Za-z0-9_+\\-]+(/[A-Za-z0-9_+\\-]+)*$"
          }
        }
      }
    },
    "members": {
      "type": "array",
      "minItems": 1,
      "items": {
        "type": "object",
        "additionalProperties": false,
        "required": [
          "member",
          "cameraCode",
          "recordingStartLocal",
          "recordingTime"
        ],
        "properties": {
          "member": {
            "type": "string",
            "minLength": 1,
            "maxLength": 1024,
            "pattern": "^(?!/)(?!.*(^|/)\\.{1,2}(/|$))(?!.*//)[^\\\\:\\r\\n\\x00]+(?<!/)$"
          },
          "cameraCode": {
            "type": "string",
            "pattern": "^S32-[A-Z0-9-]{1,28}$"
          },
          "recordingStartLocal": {
            "type": "string",
            "pattern": "^\\d{4}-\\d{2}-\\d{2}T\\d{2}:\\d{2}:\\d{2}$"
          },
          "recordingTime": {
            "oneOf": [
              {
                "type": "object",
                "additionalProperties": false,
                "required": [
                  "source",
                  "evidence"
                ],
                "properties": {
                  "source": {
                    "const": "release-metadata"
                  },
                  "evidence": {
                    "type": "object",
                    "additionalProperties": false,
                    "required": [
                      "releaseRecordSha256",
                      "member"
                    ],
                    "properties": {
                      "releaseRecordSha256": {
                        "type": "string",
                        "pattern": "^[0-9a-f]{64}$"
                      },
                      "member": {
                        "type": "string",
                        "minLength": 1,
                        "maxLength": 1024,
                        "pattern": "^(?!/)(?!.*(^|/)\\.{1,2}(/|$))(?!.*//)[^\\\\:\\r\\n\\x00]+(?<!/)$"
                      }
                    }
                  }
                }
              },
              {
                "type": "object",
                "additionalProperties": false,
                "required": [
                  "source",
                  "convention"
                ],
                "properties": {
                  "source": {
                    "const": "development-convention"
                  },
                  "convention": {
                    "type": "object",
                    "additionalProperties": false,
                    "required": [
                      "sha256",
                      "gitCommit",
                      "gitPath"
                    ],
                    "properties": {
                      "sha256": {
                        "type": "string",
                        "pattern": "^[0-9a-f]{64}$"
                      },
                      "gitCommit": {
                        "type": "string",
                        "pattern": "^[0-9a-f]{40}$"
                      },
                      "gitPath": {
                        "const": "docs/qualification/stage3/s3-2-ingestion-convention.md"
                      }
                    }
                  }
                }
              }
            ]
          }
        }
      }
    }
  }
}
